{
  "$schema": "https://json-schema.org/draft/2020-12/schema",
  "$id": "https://signal-engine.local/schemas/case_review_bundle.schema.json",
  "title": "Signal Engine case review bundle",
  "type": "object",
  "required": [
    "bundle_id",
    "generated_at",
    "status_label",
    "case_id",
    "ticker",
    "company",
    "fiscal_period",
    "object_count",
    "reviewed_query_count",
    "reviewed_eligible_query_count",
    "retrieval_object_refs",
    "reviewed_query_refs",
    "provenance_refs",
    "safe_report_refs",
    "readiness_flags",
    "blocked_reasons",
    "no_raw_text",
    "provider_execution",
    "embeddings_generated",
    "vector_db_generated",
    "evaluated_retrieval_quality",
    "production_claims"
  ],
  "properties": {
    "bundle_id": {"type": "string", "pattern": "^case_review_bundle:[a-z0-9_]+$"},
    "generated_at": {"type": "string", "pattern": "^\\d{4}-\\d{2}-\\d{2}T\\d{2}:\\d{2}:\\d{2}Z$"},
    "status_label": {"const": "case_review_bundle_metadata_only"},
    "case_id": {"type": "string", "minLength": 1},
    "ticker": {"type": "string"},
    "company": {"type": "string"},
    "fiscal_period": {"type": "string"},
    "object_count": {"type": "integer", "minimum": 1},
    "reviewed_query_count": {"type": "integer", "minimum": 0},
    "reviewed_eligible_query_count": {"type": "integer", "minimum": 0},
    "retrieval_object_refs": {
      "type": "array",
      "minItems": 1,
      "items": {
        "type": "object",
        "required": [
          "object_id",
          "object_type",
          "case_id",
          "source_type",
          "source_hash",
          "text_hash",
          "normalized_transcript_hash",
          "provenance_hash",
          "provenance_ref",
          "section_label",
          "speaker_role",
          "topic",
          "retrieval_priority",
          "content_included",
          "embeddings_included",
          "vector_db_included"
        ],
        "properties": {
          "object_id": {"type": "string", "pattern": "^rom_(semantic|event|evidence)_[0-9a-f]{16}$"},
          "object_type": {
            "enum": [
              "semantic_chunk_metadata",
              "event_aligned_chunk_metadata",
              "evidence_object_metadata"
            ]
          },
          "case_id": {"type": "string", "minLength": 1},
          "source_type": {"type": "string", "minLength": 1},
          "source_hash": {"type": "string", "pattern": "^sha256:[0-9a-f]{64}$"},
          "text_hash": {"type": "string", "pattern": "^sha256:[0-9a-f]{64}$"},
          "normalized_transcript_hash": {"type": "string", "pattern": "^sha256:[0-9a-f]{64}$"},
          "provenance_hash": {"type": "string", "pattern": "^sha256:[0-9a-f]{64}$"},
          "provenance_ref": {"type": "string", "minLength": 1},
          "section_label": {"type": "string"},
          "speaker_role": {"type": "string"},
          "topic": {"type": "string"},
          "retrieval_priority": {"type": "integer", "minimum": 1},
          "content_included": {"const": false},
          "embeddings_included": {"const": false},
          "vector_db_included": {"const": false}
        },
        "additionalProperties": false
      }
    },
    "reviewed_query_refs": {
      "type": "array",
      "items": {
        "type": "object",
        "required": [
          "query_id",
          "case_id",
          "query_type",
          "query_text_or_safe_query_label",
          "expected_object_ids",
          "expected_object_types",
          "evidence_object_id_refs",
          "provenance_refs",
          "review_status",
          "benchmark_eligible"
        ],
        "properties": {
          "query_id": {"type": "string", "minLength": 1},
          "case_id": {"type": "string", "minLength": 1},
          "query_type": {"type": "string", "minLength": 1},
          "query_text_or_safe_query_label": {"type": "string", "minLength": 1},
          "expected_object_ids": {
            "type": "array",
            "items": {"type": "string", "pattern": "^rom_(semantic|event|evidence)_[0-9a-f]{16}$"}
          },
          "expected_object_types": {
            "type": "array",
            "items": {
              "enum": [
                "semantic_chunk_metadata",
                "event_aligned_chunk_metadata",
                "evidence_object_metadata"
              ]
            }
          },
          "evidence_object_id_refs": {
            "type": "array",
            "items": {"type": "string", "pattern": "^rom_evidence_[0-9a-f]{16}$"}
          },
          "provenance_refs": {
            "type": "array",
            "minItems": 1,
            "items": {"type": "string", "minLength": 1}
          },
          "review_status": {
            "enum": [
              "template_only",
              "smoke_only",
              "review_pending",
              "reviewed",
              "rejected"
            ]
          },
          "benchmark_eligible": {"type": "boolean"}
        },
        "additionalProperties": false
      }
    },
    "provenance_refs": {
      "type": "array",
      "minItems": 1,
      "items": {"type": "string", "minLength": 1}
    },
    "safe_report_refs": {
      "type": "array",
      "items": {
        "type": "object",
        "required": ["report_type", "path", "exists"],
        "properties": {
          "report_type": {"type": "string", "minLength": 1},
          "path": {"type": "string", "minLength": 1},
          "exists": {"type": "boolean"}
        },
        "additionalProperties": false
      }
    },
    "readiness_flags": {
      "type": "object",
      "required": [
        "has_retrieval_objects",
        "has_reviewed_query_rows",
        "has_reviewed_eligible_query_rows",
        "review_pending",
        "benchmark_ready",
        "llm_review_ready",
        "provider_ready"
      ],
      "properties": {
        "has_retrieval_objects": {"type": "boolean"},
        "has_reviewed_query_rows": {"type": "boolean"},
        "has_reviewed_eligible_query_rows": {"type": "boolean"},
        "review_pending": {"type": "boolean"},
        "benchmark_ready": {"const": false},
        "llm_review_ready": {"const": false},
        "provider_ready": {"const": false}
      },
      "additionalProperties": false
    },
    "blocked_reasons": {
      "type": "array",
      "items": {"type": "string", "minLength": 1}
    },
    "no_raw_text": {"const": true},
    "provider_execution": {"const": false},
    "embeddings_generated": {"const": false},
    "vector_db_generated": {"const": false},
    "evaluated_retrieval_quality": {"const": false},
    "production_claims": {"const": false}
  },
  "additionalProperties": false
}
