{"blocked_reasons":["benchmark_threshold_not_met","evaluated_retrieval_quality_false","llm_review_disabled","no_benchmark_eligible_query_rows","no_reviewed_query_rows_for_case","provider_execution_disabled"],"bundle_id":"case_review_bundle:jpm_2025_q1","case_id":"jpm_2025_q1","company":"JPMorgan Chase & Co.","embeddings_generated":false,"evaluated_retrieval_quality":false,"fiscal_period":"2025 Q1","generated_at":"1970-01-01T00:00:00Z","no_raw_text":true,"object_count":6,"production_claims":false,"provenance_refs":["/Users/keith/Desktop/earnings calls 100 samples/JPM_JPMorgan_Chase_Co/jpm_2025_q1/metadata/normalized_transcript.json"],"provider_execution":false,"readiness_flags":{"benchmark_ready":false,"has_retrieval_objects":true,"has_reviewed_eligible_query_rows":false,"has_reviewed_query_rows":false,"llm_review_ready":false,"provider_ready":false,"review_pending":false},"retrieval_object_refs":[{"case_id":"jpm_2025_q1","content_included":false,"embeddings_included":false,"normalized_transcript_hash":"sha256:cac2b59a92287f9dc606ff9d040470b3c7e8b0abab28950ed9f11f0f23e396a4","object_id":"rom_evidence_2244b44f06199571","object_type":"evidence_object_metadata","provenance_hash":"sha256:d2bfe6e04bb0db8355138dd59939a94ab2b86ec12015a4c5db929f7d08cff68b","provenance_ref":"/Users/keith/Desktop/earnings calls 100 samples/JPM_JPMorgan_Chase_Co/jpm_2025_q1/metadata/normalized_transcript.json","retrieval_priority":1,"section_label":"prepared_remarks","source_hash":"sha256:4443844be1c36e8aa3826e7713da962087469b319aad806800526919906d3967","source_type":"manual_local_transcript_evidence","speaker_role":"management","text_hash":"sha256:8e2a343c5862cc1cbc540e12580c813c7d00e651c774d7f6986c3a40dc9b8b6e","topic":"prepared_remarks","vector_db_included":false},{"case_id":"jpm_2025_q1","content_included":false,"embeddings_included":false,"normalized_transcript_hash":"sha256:cac2b59a92287f9dc606ff9d040470b3c7e8b0abab28950ed9f11f0f23e396a4","object_id":"rom_event_6a50bb972c63f652","object_type":"event_aligned_chunk_metadata","provenance_hash":"sha256:c526b33fda21cc4f6e0a95c668995155e1c5a043d5b0612bef49b5ba86e234d8","provenance_ref":"/Users/keith/Desktop/earnings calls 100 samples/JPM_JPMorgan_Chase_Co/jpm_2025_q1/metadata/normalized_transcript.json","retrieval_priority":2,"section_label":"prepared_remarks","source_hash":"sha256:4443844be1c36e8aa3826e7713da962087469b319aad806800526919906d3967","source_type":"manual_local_transcript_chunk","speaker_role":"management","text_hash":"sha256:8e2a343c5862cc1cbc540e12580c813c7d00e651c774d7f6986c3a40dc9b8b6e","topic":"prepared_remarks","vector_db_included":false},{"case_id":"jpm_2025_q1","content_included":false,"embeddings_included":false,"normalized_transcript_hash":"sha256:cac2b59a92287f9dc606ff9d040470b3c7e8b0abab28950ed9f11f0f23e396a4","object_id":"rom_semantic_01d4c394d39f7c99","object_type":"semantic_chunk_metadata","provenance_hash":"sha256:7cd85dc81c41d3b8907b4afa17f70eb46eb02067d0da9ca9f81563afbbf6dbbe","provenance_ref":"/Users/keith/Desktop/earnings calls 100 samples/JPM_JPMorgan_Chase_Co/jpm_2025_q1/metadata/normalized_transcript.json","retrieval_priority":3,"section_label":"unknown","source_hash":"sha256:4443844be1c36e8aa3826e7713da962087469b319aad806800526919906d3967","source_type":"manual_local_transcript_chunk","speaker_role":"unknown","text_hash":"sha256:73745b6dc3d0124430f2c5893b560f645a98df445c2ff41d15bd39b09f9f2e71","topic":"semantic_fallback","vector_db_included":false},{"case_id":"jpm_2025_q1","content_included":false,"embeddings_included":false,"normalized_transcript_hash":"sha256:cac2b59a92287f9dc606ff9d040470b3c7e8b0abab28950ed9f11f0f23e396a4","object_id":"rom_semantic_2d7ceccbb01c9041","object_type":"semantic_chunk_metadata","provenance_hash":"sha256:ec9959e783cc8bc99157cea17cf4928377a4ac72b55ea17815d995e3b3d3ed47","provenance_ref":"/Users/keith/Desktop/earnings calls 100 samples/JPM_JPMorgan_Chase_Co/jpm_2025_q1/metadata/normalized_transcript.json","retrieval_priority":3,"section_label":"unknown","source_hash":"sha256:4443844be1c36e8aa3826e7713da962087469b319aad806800526919906d3967","source_type":"manual_local_transcript_chunk","speaker_role":"unknown","text_hash":"sha256:b5dce81ccb90675dc3a439f8e9023e5e47f9615f09911665ced8941bea970829","topic":"semantic_fallback","vector_db_included":false},{"case_id":"jpm_2025_q1","content_included":false,"embeddings_included":false,"normalized_transcript_hash":"sha256:cac2b59a92287f9dc606ff9d040470b3c7e8b0abab28950ed9f11f0f23e396a4","object_id":"rom_semantic_7e996c7ac7211c12","object_type":"semantic_chunk_metadata","provenance_hash":"sha256:ef829090710536007ae043823de0ab0fbf73babd2d816e875d6c4bdfefd27118","provenance_ref":"/Users/keith/Desktop/earnings calls 100 samples/JPM_JPMorgan_Chase_Co/jpm_2025_q1/metadata/normalized_transcript.json","retrieval_priority":3,"section_label":"unknown","source_hash":"sha256:4443844be1c36e8aa3826e7713da962087469b319aad806800526919906d3967","source_type":"manual_local_transcript_chunk","speaker_role":"unknown","text_hash":"sha256:925f0e59e3335c2c126e02d5e86c9d3bc70ceeb4f3df092b6301f4a238d9156c","topic":"semantic_fallback","vector_db_included":false},{"case_id":"jpm_2025_q1","content_included":false,"embeddings_included":false,"normalized_transcript_hash":"sha256:cac2b59a92287f9dc606ff9d040470b3c7e8b0abab28950ed9f11f0f23e396a4","object_id":"rom_semantic_a12453013b052054","object_type":"semantic_chunk_metadata","provenance_hash":"sha256:b92d3c7d56f673d5d2a9e3974fbd2c988e8c59a848f6cd1fb1471781b731ea35","provenance_ref":"/Users/keith/Desktop/earnings calls 100 samples/JPM_JPMorgan_Chase_Co/jpm_2025_q1/metadata/normalized_transcript.json","retrieval_priority":3,"section_label":"unknown","source_hash":"sha256:4443844be1c36e8aa3826e7713da962087469b319aad806800526919906d3967","source_type":"manual_local_transcript_chunk","speaker_role":"unknown","text_hash":"sha256:ef64201ed887965101970afa0cabe156719bf4c60509d388608214bd20effebb","topic":"semantic_fallback","vector_db_included":false}],"reviewed_eligible_query_count":0,"reviewed_query_count":0,"reviewed_query_refs":[],"safe_report_refs":[{"exists":true,"path":"reports/retrieval/retrieval_object_metadata_export.md","report_type":"retrieval_object_metadata_export"},{"exists":true,"path":"reports/retrieval/retrieval_reviewed_query_set_first20_packet.md","report_type":"first20_review_packet"},{"exists":true,"path":"reports/retrieval/retrieval_bakeoff_first20_review_pending_plan.md","report_type":"first20_bakeoff_plan"},{"exists":true,"path":"reports/retrieval/retrieval_review_import_summary.md","report_type":"review_import_summary"}],"status_label":"case_review_bundle_metadata_only","ticker":"JPM","vector_db_generated":false}
