{"blocked_reasons":["benchmark_threshold_not_met","evaluated_retrieval_quality_false","llm_review_disabled","no_benchmark_eligible_query_rows","no_reviewed_query_rows_for_case","provider_execution_disabled"],"bundle_id":"case_review_bundle:jpm_2025_q2","case_id":"jpm_2025_q2","company":"JPMorgan Chase & Co.","embeddings_generated":false,"evaluated_retrieval_quality":false,"fiscal_period":"2025 Q2","generated_at":"1970-01-01T00:00:00Z","no_raw_text":true,"object_count":5,"production_claims":false,"provenance_refs":["/Users/keith/Desktop/earnings calls 100 samples/JPM_JPMorgan_Chase_Co/jpm_2025_q2/metadata/normalized_transcript.json"],"provider_execution":false,"readiness_flags":{"benchmark_ready":false,"has_retrieval_objects":true,"has_reviewed_eligible_query_rows":false,"has_reviewed_query_rows":false,"llm_review_ready":false,"provider_ready":false,"review_pending":false},"retrieval_object_refs":[{"case_id":"jpm_2025_q2","content_included":false,"embeddings_included":false,"normalized_transcript_hash":"sha256:f26723b03dec27890010ff4b9edf2d2b4be1300b4aecd1e4b3b28205eebd22d3","object_id":"rom_evidence_5ae6a7fec9af4174","object_type":"evidence_object_metadata","provenance_hash":"sha256:2291e873eaabaa8adc19bc66d838d1ab73f569b3eb4c386ddb5a542ba1c7e1cf","provenance_ref":"/Users/keith/Desktop/earnings calls 100 samples/JPM_JPMorgan_Chase_Co/jpm_2025_q2/metadata/normalized_transcript.json","retrieval_priority":1,"section_label":"prepared_remarks","source_hash":"sha256:e126c41a79d11ac4edb3e422042198d10962a2a0c7c7036704544fb826bcbbba","source_type":"manual_local_transcript_evidence","speaker_role":"management","text_hash":"sha256:8e2a343c5862cc1cbc540e12580c813c7d00e651c774d7f6986c3a40dc9b8b6e","topic":"prepared_remarks","vector_db_included":false},{"case_id":"jpm_2025_q2","content_included":false,"embeddings_included":false,"normalized_transcript_hash":"sha256:f26723b03dec27890010ff4b9edf2d2b4be1300b4aecd1e4b3b28205eebd22d3","object_id":"rom_event_135027731e5099e8","object_type":"event_aligned_chunk_metadata","provenance_hash":"sha256:a51f32347a155c538c87f065f37aafeac520e396577700607c806f684ca73ddd","provenance_ref":"/Users/keith/Desktop/earnings calls 100 samples/JPM_JPMorgan_Chase_Co/jpm_2025_q2/metadata/normalized_transcript.json","retrieval_priority":2,"section_label":"prepared_remarks","source_hash":"sha256:e126c41a79d11ac4edb3e422042198d10962a2a0c7c7036704544fb826bcbbba","source_type":"manual_local_transcript_chunk","speaker_role":"management","text_hash":"sha256:8e2a343c5862cc1cbc540e12580c813c7d00e651c774d7f6986c3a40dc9b8b6e","topic":"prepared_remarks","vector_db_included":false},{"case_id":"jpm_2025_q2","content_included":false,"embeddings_included":false,"normalized_transcript_hash":"sha256:f26723b03dec27890010ff4b9edf2d2b4be1300b4aecd1e4b3b28205eebd22d3","object_id":"rom_semantic_27619faafef8f4f8","object_type":"semantic_chunk_metadata","provenance_hash":"sha256:d2765412e7f251c32831deb3547bfbb64ab379f320bc40c1421d89d6c7f6f492","provenance_ref":"/Users/keith/Desktop/earnings calls 100 samples/JPM_JPMorgan_Chase_Co/jpm_2025_q2/metadata/normalized_transcript.json","retrieval_priority":3,"section_label":"unknown","source_hash":"sha256:e126c41a79d11ac4edb3e422042198d10962a2a0c7c7036704544fb826bcbbba","source_type":"manual_local_transcript_chunk","speaker_role":"unknown","text_hash":"sha256:81474fd3d33c62b640900d869079a331ce727bbf22b9eca544c30e2d92296337","topic":"semantic_fallback","vector_db_included":false},{"case_id":"jpm_2025_q2","content_included":false,"embeddings_included":false,"normalized_transcript_hash":"sha256:f26723b03dec27890010ff4b9edf2d2b4be1300b4aecd1e4b3b28205eebd22d3","object_id":"rom_semantic_73d5b406fd37dc36","object_type":"semantic_chunk_metadata","provenance_hash":"sha256:6aa0d4330a9389321e6758137ba414f6e786b7c4888c01e3489bc6b48eb57794","provenance_ref":"/Users/keith/Desktop/earnings calls 100 samples/JPM_JPMorgan_Chase_Co/jpm_2025_q2/metadata/normalized_transcript.json","retrieval_priority":3,"section_label":"unknown","source_hash":"sha256:e126c41a79d11ac4edb3e422042198d10962a2a0c7c7036704544fb826bcbbba","source_type":"manual_local_transcript_chunk","speaker_role":"unknown","text_hash":"sha256:d18b3e79097079671c2737f9ec90ccc778e460fd0dbbff2bcdffc5e42282c9cc","topic":"semantic_fallback","vector_db_included":false},{"case_id":"jpm_2025_q2","content_included":false,"embeddings_included":false,"normalized_transcript_hash":"sha256:f26723b03dec27890010ff4b9edf2d2b4be1300b4aecd1e4b3b28205eebd22d3","object_id":"rom_semantic_8065619cdf063c33","object_type":"semantic_chunk_metadata","provenance_hash":"sha256:8f8fe7d370a3f9e8d445d6e824a60656b9b7f29d8716a7040605d637ef7da280","provenance_ref":"/Users/keith/Desktop/earnings calls 100 samples/JPM_JPMorgan_Chase_Co/jpm_2025_q2/metadata/normalized_transcript.json","retrieval_priority":3,"section_label":"unknown","source_hash":"sha256:e126c41a79d11ac4edb3e422042198d10962a2a0c7c7036704544fb826bcbbba","source_type":"manual_local_transcript_chunk","speaker_role":"unknown","text_hash":"sha256:ef04520d91b46bfe713f929a9f5bf447c1c68e127123e103079de5a4d229a0f8","topic":"semantic_fallback","vector_db_included":false}],"reviewed_eligible_query_count":0,"reviewed_query_count":0,"reviewed_query_refs":[],"safe_report_refs":[{"exists":true,"path":"reports/retrieval/retrieval_object_metadata_export.md","report_type":"retrieval_object_metadata_export"},{"exists":true,"path":"reports/retrieval/retrieval_reviewed_query_set_first20_packet.md","report_type":"first20_review_packet"},{"exists":true,"path":"reports/retrieval/retrieval_bakeoff_first20_review_pending_plan.md","report_type":"first20_bakeoff_plan"},{"exists":true,"path":"reports/retrieval/retrieval_review_import_summary.md","report_type":"review_import_summary"}],"status_label":"case_review_bundle_metadata_only","ticker":"JPM","vector_db_generated":false}
