{"blocked_reasons":["benchmark_threshold_not_met","evaluated_retrieval_quality_false","llm_review_disabled","no_benchmark_eligible_query_rows","no_reviewed_query_rows_for_case","provider_execution_disabled"],"bundle_id":"case_review_bundle:jpm_2025_q3","case_id":"jpm_2025_q3","company":"JPMorgan Chase & Co.","embeddings_generated":false,"evaluated_retrieval_quality":false,"fiscal_period":"2025 Q3","generated_at":"1970-01-01T00:00:00Z","no_raw_text":true,"object_count":4,"production_claims":false,"provenance_refs":["/Users/keith/Desktop/earnings calls 100 samples/JPM_JPMorgan_Chase_Co/jpm_2025_q3/metadata/normalized_transcript.json"],"provider_execution":false,"readiness_flags":{"benchmark_ready":false,"has_retrieval_objects":true,"has_reviewed_eligible_query_rows":false,"has_reviewed_query_rows":false,"llm_review_ready":false,"provider_ready":false,"review_pending":false},"retrieval_object_refs":[{"case_id":"jpm_2025_q3","content_included":false,"embeddings_included":false,"normalized_transcript_hash":"sha256:5c8c3d23ba64f0199ef5d6225ed064d816ee9455edd8fb4bd0f9e4b7ffabc706","object_id":"rom_evidence_12279ddb62bf49ad","object_type":"evidence_object_metadata","provenance_hash":"sha256:b92ea0b220ca14eab5269bd9f90c1c9c869a866ba37541148aad962883a9ae48","provenance_ref":"/Users/keith/Desktop/earnings calls 100 samples/JPM_JPMorgan_Chase_Co/jpm_2025_q3/metadata/normalized_transcript.json","retrieval_priority":1,"section_label":"prepared_remarks","source_hash":"sha256:785605abf40743a5f4d14c36a363ea22afc8f3fdfe1e59fe3c5b8b225db50737","source_type":"manual_local_transcript_evidence","speaker_role":"management","text_hash":"sha256:8e2a343c5862cc1cbc540e12580c813c7d00e651c774d7f6986c3a40dc9b8b6e","topic":"prepared_remarks","vector_db_included":false},{"case_id":"jpm_2025_q3","content_included":false,"embeddings_included":false,"normalized_transcript_hash":"sha256:5c8c3d23ba64f0199ef5d6225ed064d816ee9455edd8fb4bd0f9e4b7ffabc706","object_id":"rom_event_ee1e2a0e41f77574","object_type":"event_aligned_chunk_metadata","provenance_hash":"sha256:0a1de73c06789f1e48152c88582ca2f7dc4ebf41d05d1794170999908c87b025","provenance_ref":"/Users/keith/Desktop/earnings calls 100 samples/JPM_JPMorgan_Chase_Co/jpm_2025_q3/metadata/normalized_transcript.json","retrieval_priority":2,"section_label":"prepared_remarks","source_hash":"sha256:785605abf40743a5f4d14c36a363ea22afc8f3fdfe1e59fe3c5b8b225db50737","source_type":"manual_local_transcript_chunk","speaker_role":"management","text_hash":"sha256:8e2a343c5862cc1cbc540e12580c813c7d00e651c774d7f6986c3a40dc9b8b6e","topic":"prepared_remarks","vector_db_included":false},{"case_id":"jpm_2025_q3","content_included":false,"embeddings_included":false,"normalized_transcript_hash":"sha256:5c8c3d23ba64f0199ef5d6225ed064d816ee9455edd8fb4bd0f9e4b7ffabc706","object_id":"rom_semantic_9270a96b0fb68026","object_type":"semantic_chunk_metadata","provenance_hash":"sha256:bbb0b6c3fc25d4aee17b06dd5418316872f61abac144f919647e8b603b6db643","provenance_ref":"/Users/keith/Desktop/earnings calls 100 samples/JPM_JPMorgan_Chase_Co/jpm_2025_q3/metadata/normalized_transcript.json","retrieval_priority":3,"section_label":"unknown","source_hash":"sha256:785605abf40743a5f4d14c36a363ea22afc8f3fdfe1e59fe3c5b8b225db50737","source_type":"manual_local_transcript_chunk","speaker_role":"unknown","text_hash":"sha256:bd3729321d878fd210c04579c4e542295bee0a926ccf61d215688a31112ab650","topic":"semantic_fallback","vector_db_included":false},{"case_id":"jpm_2025_q3","content_included":false,"embeddings_included":false,"normalized_transcript_hash":"sha256:5c8c3d23ba64f0199ef5d6225ed064d816ee9455edd8fb4bd0f9e4b7ffabc706","object_id":"rom_semantic_d646ee334ee97d79","object_type":"semantic_chunk_metadata","provenance_hash":"sha256:6a284d84ef58a68eed1bd53ad15f6694a90ca6f3f24b93fa3d8aaaf36c051ef5","provenance_ref":"/Users/keith/Desktop/earnings calls 100 samples/JPM_JPMorgan_Chase_Co/jpm_2025_q3/metadata/normalized_transcript.json","retrieval_priority":3,"section_label":"unknown","source_hash":"sha256:785605abf40743a5f4d14c36a363ea22afc8f3fdfe1e59fe3c5b8b225db50737","source_type":"manual_local_transcript_chunk","speaker_role":"unknown","text_hash":"sha256:37fe922f83bafca2c784f4724252f35e90ed1cc810029ec3b6130d015aaed2cd","topic":"semantic_fallback","vector_db_included":false}],"reviewed_eligible_query_count":0,"reviewed_query_count":0,"reviewed_query_refs":[],"safe_report_refs":[{"exists":true,"path":"reports/retrieval/retrieval_object_metadata_export.md","report_type":"retrieval_object_metadata_export"},{"exists":true,"path":"reports/retrieval/retrieval_reviewed_query_set_first20_packet.md","report_type":"first20_review_packet"},{"exists":true,"path":"reports/retrieval/retrieval_bakeoff_first20_review_pending_plan.md","report_type":"first20_bakeoff_plan"},{"exists":true,"path":"reports/retrieval/retrieval_review_import_summary.md","report_type":"review_import_summary"}],"status_label":"case_review_bundle_metadata_only","ticker":"JPM","vector_db_generated":false}
