{"blocked_reasons":["benchmark_threshold_not_met","evaluated_retrieval_quality_false","llm_review_disabled","no_benchmark_eligible_query_rows","provider_execution_disabled","reviewed_queries_pending"],"bundle_id":"case_review_bundle:jpm_2024_q3","case_id":"jpm_2024_q3","company":"JPMorgan Chase & Co.","embeddings_generated":false,"evaluated_retrieval_quality":false,"fiscal_period":"2024 Q3","generated_at":"1970-01-01T00:00:00Z","no_raw_text":true,"object_count":5,"production_claims":false,"provenance_refs":["/Users/keith/Desktop/earnings calls 100 samples/JPM_JPMorgan_Chase_Co/jpm_2024_q3/metadata/normalized_transcript.json"],"provider_execution":false,"readiness_flags":{"benchmark_ready":false,"has_retrieval_objects":true,"has_reviewed_eligible_query_rows":false,"has_reviewed_query_rows":true,"llm_review_ready":false,"provider_ready":false,"review_pending":true},"retrieval_object_refs":[{"case_id":"jpm_2024_q3","content_included":false,"embeddings_included":false,"normalized_transcript_hash":"sha256:ef8079d89554b1ecb4abc2c35c074435ae9c15048a05a2f48194422f0009cdc0","object_id":"rom_evidence_96da72f32f422fc6","object_type":"evidence_object_metadata","provenance_hash":"sha256:e4a84c5368ab77fc6f7f68b1bbfff3c80a4d14dd74bb31f52ebb6606e581530f","provenance_ref":"/Users/keith/Desktop/earnings calls 100 samples/JPM_JPMorgan_Chase_Co/jpm_2024_q3/metadata/normalized_transcript.json","retrieval_priority":1,"section_label":"prepared_remarks","source_hash":"sha256:23979f93ec4f88a7a31d13e23bc4c0aa3e7d7f9e02300c4a6fba0ef0043444e0","source_type":"manual_local_transcript_evidence","speaker_role":"management","text_hash":"sha256:8e2a343c5862cc1cbc540e12580c813c7d00e651c774d7f6986c3a40dc9b8b6e","topic":"prepared_remarks","vector_db_included":false},{"case_id":"jpm_2024_q3","content_included":false,"embeddings_included":false,"normalized_transcript_hash":"sha256:ef8079d89554b1ecb4abc2c35c074435ae9c15048a05a2f48194422f0009cdc0","object_id":"rom_event_bc469a7775982588","object_type":"event_aligned_chunk_metadata","provenance_hash":"sha256:8c3d06b3dac504c8299df7facb75136837c1f3ee9db7e169e5ba714c8fba9f9f","provenance_ref":"/Users/keith/Desktop/earnings calls 100 samples/JPM_JPMorgan_Chase_Co/jpm_2024_q3/metadata/normalized_transcript.json","retrieval_priority":2,"section_label":"prepared_remarks","source_hash":"sha256:23979f93ec4f88a7a31d13e23bc4c0aa3e7d7f9e02300c4a6fba0ef0043444e0","source_type":"manual_local_transcript_chunk","speaker_role":"management","text_hash":"sha256:8e2a343c5862cc1cbc540e12580c813c7d00e651c774d7f6986c3a40dc9b8b6e","topic":"prepared_remarks","vector_db_included":false},{"case_id":"jpm_2024_q3","content_included":false,"embeddings_included":false,"normalized_transcript_hash":"sha256:ef8079d89554b1ecb4abc2c35c074435ae9c15048a05a2f48194422f0009cdc0","object_id":"rom_semantic_120e4bc4bd323e22","object_type":"semantic_chunk_metadata","provenance_hash":"sha256:c7de1f12bf68f77ed007627fed416bbb7055aa557b6ec963dca868b77ab79790","provenance_ref":"/Users/keith/Desktop/earnings calls 100 samples/JPM_JPMorgan_Chase_Co/jpm_2024_q3/metadata/normalized_transcript.json","retrieval_priority":3,"section_label":"unknown","source_hash":"sha256:23979f93ec4f88a7a31d13e23bc4c0aa3e7d7f9e02300c4a6fba0ef0043444e0","source_type":"manual_local_transcript_chunk","speaker_role":"unknown","text_hash":"sha256:02d54b65f136ee37de6446219bb5f0df19c1d6e0893066b88320af416e925cf2","topic":"semantic_fallback","vector_db_included":false},{"case_id":"jpm_2024_q3","content_included":false,"embeddings_included":false,"normalized_transcript_hash":"sha256:ef8079d89554b1ecb4abc2c35c074435ae9c15048a05a2f48194422f0009cdc0","object_id":"rom_semantic_16e724e9f2d91afb","object_type":"semantic_chunk_metadata","provenance_hash":"sha256:9d6b1a803de63c25771ec902cdcc82aadb599ea6640d9e4e3d1bd6e2a2a0befc","provenance_ref":"/Users/keith/Desktop/earnings calls 100 samples/JPM_JPMorgan_Chase_Co/jpm_2024_q3/metadata/normalized_transcript.json","retrieval_priority":3,"section_label":"unknown","source_hash":"sha256:23979f93ec4f88a7a31d13e23bc4c0aa3e7d7f9e02300c4a6fba0ef0043444e0","source_type":"manual_local_transcript_chunk","speaker_role":"unknown","text_hash":"sha256:988e009aeb6cb9edd3bf1d84f71a0bcaa006f3d9c982dad0deea3e9c6718011b","topic":"semantic_fallback","vector_db_included":false},{"case_id":"jpm_2024_q3","content_included":false,"embeddings_included":false,"normalized_transcript_hash":"sha256:ef8079d89554b1ecb4abc2c35c074435ae9c15048a05a2f48194422f0009cdc0","object_id":"rom_semantic_efeca17f0d148d43","object_type":"semantic_chunk_metadata","provenance_hash":"sha256:d2c39053cce990f3ec6e380585b63d209ee3123b5e26b69d12ed3c5c1d8c34de","provenance_ref":"/Users/keith/Desktop/earnings calls 100 samples/JPM_JPMorgan_Chase_Co/jpm_2024_q3/metadata/normalized_transcript.json","retrieval_priority":3,"section_label":"unknown","source_hash":"sha256:23979f93ec4f88a7a31d13e23bc4c0aa3e7d7f9e02300c4a6fba0ef0043444e0","source_type":"manual_local_transcript_chunk","speaker_role":"unknown","text_hash":"sha256:b050b5281ff667658223edcb5fa5d7481372251f830796fb283363dc34849215","topic":"semantic_fallback","vector_db_included":false}],"reviewed_eligible_query_count":0,"reviewed_query_count":1,"reviewed_query_refs":[{"benchmark_eligible":false,"case_id":"jpm_2024_q3","evidence_object_id_refs":["rom_evidence_96da72f32f422fc6"],"expected_object_ids":["rom_evidence_96da72f32f422fc6"],"expected_object_types":["evidence_object_metadata"],"provenance_refs":["/Users/keith/Desktop/earnings calls 100 samples/JPM_JPMorgan_Chase_Co/jpm_2024_q3/metadata/normalized_transcript.json"],"query_id":"rq_first20_jpm_2024_q3_015","query_text_or_safe_query_label":"SAFE_LABEL:jpm_2024_q3:prepared_remarks:evidence_object_metadata:015","query_type":"case_comparison_lookup","review_status":"review_pending"}],"safe_report_refs":[{"exists":true,"path":"reports/retrieval/retrieval_object_metadata_export.md","report_type":"retrieval_object_metadata_export"},{"exists":true,"path":"reports/retrieval/retrieval_reviewed_query_set_first20_packet.md","report_type":"first20_review_packet"},{"exists":true,"path":"reports/retrieval/retrieval_bakeoff_first20_review_pending_plan.md","report_type":"first20_bakeoff_plan"},{"exists":true,"path":"reports/retrieval/retrieval_review_import_summary.md","report_type":"review_import_summary"}],"status_label":"case_review_bundle_metadata_only","ticker":"JPM","vector_db_generated":false}
