{"blocked_reasons":["benchmark_threshold_not_met","evaluated_retrieval_quality_false","llm_review_disabled","no_benchmark_eligible_query_rows","provider_execution_disabled","reviewed_queries_pending"],"bundle_id":"case_review_bundle:jpm_2024_q2","case_id":"jpm_2024_q2","company":"JPMorgan Chase & Co.","embeddings_generated":false,"evaluated_retrieval_quality":false,"fiscal_period":"2024 Q2","generated_at":"1970-01-01T00:00:00Z","no_raw_text":true,"object_count":6,"production_claims":false,"provenance_refs":["/Users/keith/Desktop/earnings calls 100 samples/JPM_JPMorgan_Chase_Co/jpm_2024_q2/metadata/normalized_transcript.json"],"provider_execution":false,"readiness_flags":{"benchmark_ready":false,"has_retrieval_objects":true,"has_reviewed_eligible_query_rows":false,"has_reviewed_query_rows":true,"llm_review_ready":false,"provider_ready":false,"review_pending":true},"retrieval_object_refs":[{"case_id":"jpm_2024_q2","content_included":false,"embeddings_included":false,"normalized_transcript_hash":"sha256:4fbf0ef593a6b1b822fa118d6b245f0b184ab7f65f7d090e943f427016c5e647","object_id":"rom_evidence_c04c6c85d0287e43","object_type":"evidence_object_metadata","provenance_hash":"sha256:e63b39188a85f6b3b8d3b3cac50938a00a5a8233aeb49024ed0b87d109479811","provenance_ref":"/Users/keith/Desktop/earnings calls 100 samples/JPM_JPMorgan_Chase_Co/jpm_2024_q2/metadata/normalized_transcript.json","retrieval_priority":1,"section_label":"prepared_remarks","source_hash":"sha256:da03ff9709cda967dc85fec54235bd1a2f97682fa5b3b236e084bbdcf8151585","source_type":"manual_local_transcript_evidence","speaker_role":"management","text_hash":"sha256:3f02830d75e3cecc935c1bc8c518458e3ef202d91de2ca41392b12ee4b72950f","topic":"prepared_remarks","vector_db_included":false},{"case_id":"jpm_2024_q2","content_included":false,"embeddings_included":false,"normalized_transcript_hash":"sha256:4fbf0ef593a6b1b822fa118d6b245f0b184ab7f65f7d090e943f427016c5e647","object_id":"rom_event_ab1b0a8300000324","object_type":"event_aligned_chunk_metadata","provenance_hash":"sha256:0715133960ac141e13c5de283899299e585d9fa7e9fd69f5fe4f87980319b68d","provenance_ref":"/Users/keith/Desktop/earnings calls 100 samples/JPM_JPMorgan_Chase_Co/jpm_2024_q2/metadata/normalized_transcript.json","retrieval_priority":2,"section_label":"prepared_remarks","source_hash":"sha256:da03ff9709cda967dc85fec54235bd1a2f97682fa5b3b236e084bbdcf8151585","source_type":"manual_local_transcript_chunk","speaker_role":"management","text_hash":"sha256:3f02830d75e3cecc935c1bc8c518458e3ef202d91de2ca41392b12ee4b72950f","topic":"prepared_remarks","vector_db_included":false},{"case_id":"jpm_2024_q2","content_included":false,"embeddings_included":false,"normalized_transcript_hash":"sha256:4fbf0ef593a6b1b822fa118d6b245f0b184ab7f65f7d090e943f427016c5e647","object_id":"rom_semantic_312f96bde573e789","object_type":"semantic_chunk_metadata","provenance_hash":"sha256:ce8337060619844a683e839dd74208a2cd4d982397a397f513b97c7fc0a07833","provenance_ref":"/Users/keith/Desktop/earnings calls 100 samples/JPM_JPMorgan_Chase_Co/jpm_2024_q2/metadata/normalized_transcript.json","retrieval_priority":3,"section_label":"unknown","source_hash":"sha256:da03ff9709cda967dc85fec54235bd1a2f97682fa5b3b236e084bbdcf8151585","source_type":"manual_local_transcript_chunk","speaker_role":"unknown","text_hash":"sha256:c509ad57b556b26c050a2d2f6400adccd01d9cbadd45b2bc057e0f8588ab4b20","topic":"semantic_fallback","vector_db_included":false},{"case_id":"jpm_2024_q2","content_included":false,"embeddings_included":false,"normalized_transcript_hash":"sha256:4fbf0ef593a6b1b822fa118d6b245f0b184ab7f65f7d090e943f427016c5e647","object_id":"rom_semantic_45c33d6f56d0796d","object_type":"semantic_chunk_metadata","provenance_hash":"sha256:46e631776552469e4f2877ed55e8bab17532223c08d90d13b743fae7d3b63e88","provenance_ref":"/Users/keith/Desktop/earnings calls 100 samples/JPM_JPMorgan_Chase_Co/jpm_2024_q2/metadata/normalized_transcript.json","retrieval_priority":3,"section_label":"unknown","source_hash":"sha256:da03ff9709cda967dc85fec54235bd1a2f97682fa5b3b236e084bbdcf8151585","source_type":"manual_local_transcript_chunk","speaker_role":"unknown","text_hash":"sha256:66f0f9b1252fe2892b880a6f676520cbc89fbde3cd8fef5da54e215e51066ff4","topic":"semantic_fallback","vector_db_included":false},{"case_id":"jpm_2024_q2","content_included":false,"embeddings_included":false,"normalized_transcript_hash":"sha256:4fbf0ef593a6b1b822fa118d6b245f0b184ab7f65f7d090e943f427016c5e647","object_id":"rom_semantic_6c848e9670501859","object_type":"semantic_chunk_metadata","provenance_hash":"sha256:7b1e02b7769f77515705d4dca6a59c84ec1caad4ae2c8cf2808c92e5142b3dbc","provenance_ref":"/Users/keith/Desktop/earnings calls 100 samples/JPM_JPMorgan_Chase_Co/jpm_2024_q2/metadata/normalized_transcript.json","retrieval_priority":3,"section_label":"unknown","source_hash":"sha256:da03ff9709cda967dc85fec54235bd1a2f97682fa5b3b236e084bbdcf8151585","source_type":"manual_local_transcript_chunk","speaker_role":"unknown","text_hash":"sha256:3d41b8d25b962e7d1f42493dbdd4fe2b5fded251c2b8e878021371e5ca5c9582","topic":"semantic_fallback","vector_db_included":false},{"case_id":"jpm_2024_q2","content_included":false,"embeddings_included":false,"normalized_transcript_hash":"sha256:4fbf0ef593a6b1b822fa118d6b245f0b184ab7f65f7d090e943f427016c5e647","object_id":"rom_semantic_c91f099314eda191","object_type":"semantic_chunk_metadata","provenance_hash":"sha256:20162cae58ad17bb0df99ba885bc1a709383b154b9347079de104e91396eb6b6","provenance_ref":"/Users/keith/Desktop/earnings calls 100 samples/JPM_JPMorgan_Chase_Co/jpm_2024_q2/metadata/normalized_transcript.json","retrieval_priority":3,"section_label":"unknown","source_hash":"sha256:da03ff9709cda967dc85fec54235bd1a2f97682fa5b3b236e084bbdcf8151585","source_type":"manual_local_transcript_chunk","speaker_role":"unknown","text_hash":"sha256:eb3bbc937193587a39bedc3e5240d1b839c397be231acfa4de748835f3e2ce67","topic":"semantic_fallback","vector_db_included":false}],"reviewed_eligible_query_count":0,"reviewed_query_count":1,"reviewed_query_refs":[{"benchmark_eligible":false,"case_id":"jpm_2024_q2","evidence_object_id_refs":["rom_evidence_c04c6c85d0287e43"],"expected_object_ids":["rom_evidence_c04c6c85d0287e43"],"expected_object_types":["evidence_object_metadata"],"provenance_refs":["/Users/keith/Desktop/earnings calls 100 samples/JPM_JPMorgan_Chase_Co/jpm_2024_q2/metadata/normalized_transcript.json"],"query_id":"rq_first20_jpm_2024_q2_014","query_text_or_safe_query_label":"SAFE_LABEL:jpm_2024_q2:prepared_remarks:evidence_object_metadata:014","query_type":"case_comparison_lookup","review_status":"review_pending"}],"safe_report_refs":[{"exists":true,"path":"reports/retrieval/retrieval_object_metadata_export.md","report_type":"retrieval_object_metadata_export"},{"exists":true,"path":"reports/retrieval/retrieval_reviewed_query_set_first20_packet.md","report_type":"first20_review_packet"},{"exists":true,"path":"reports/retrieval/retrieval_bakeoff_first20_review_pending_plan.md","report_type":"first20_bakeoff_plan"},{"exists":true,"path":"reports/retrieval/retrieval_review_import_summary.md","report_type":"review_import_summary"}],"status_label":"case_review_bundle_metadata_only","ticker":"JPM","vector_db_generated":false}
